"INDEX_NR","INCIDENT_DATE","AIRPORT","STATE","OPERATOR","AIRCRAFT","COST_REPAIRS_INFL_ADJ","SPECIES","REMARKS"
616927,1994-09-12,"ARCO HIGH ISLAND HELIPORT","TX","BUSINESS","BELL-206",NA,"Unknown bird - small","FEATHERS & BIRD PARTS ENTERED LEFT FRONT OF HELICOPTER BUT  PASSENGER COULD SEE NO DAMAGE. RETURNED TO HIA-126, SHUT DOWN &  EXAMINED A/C. HALF OF A SMALL BIRD STUCK IN INLET LOUVERS OF  PASSENGER'S AIR VENT ENTRANCE. OTHER HALF OF BIRD HAD COME  THROUGH THE LOUVERS, THROUGH THE AIR DUCT, & INTO A/C.  LOUVERS  WERE SLIGHTLY DENTED IN ONE PLACE. NO OTHER DAMAGE. CLEANED A/C &  CONTD. FLT."
617234,1993-06-11,"BILLINGS LOGAN INTL","MT","DELTA AIR LINES","B-727-200",NA,"Golden eagle","NO DAMAGE"
623810,1991-09-02,"STEAMBOAT SPRINGS ARPT/BOB ADAMS FIELD","CO","PRIVATELY OWNED","STINSON 108",NA,"Mule deer","DURING T/O ROLL, JUST AFTER THE TAIL CAME UP, THE PILOT SAW A  DEER ON THE RWY.  EVASIVE ACTION CAUSED THE A/C TO DEPT THE RWY &  OVERTURN. A/C WAS SUBSTANTIALLY DAMAGED. 2 CREW SUSTAINED MINOR  INJURIES."
632190,1997-11-11,"BELUGA AIRPORT","AK","SOUTH CENTRAL","PA-31 NAVAJO",NA,"Moose","HIT MOOSE ON T/O. NO INJURIES. DAMAGE TO E WINGTIP & SPAR. NTSB REPTD DMG AS SUBSTANTIAL."
633738,1996-03-31,"UNKNOWN",NA,"US COAST GUARD","SIKORSKY UH-60",2545,"Bald eagle","ENGAGED IN FIRST LIGHT SEARCH OF OVERDUE BOATER IN THE WATERS NEAR SITKA. AN EAGLE WAS SEEN DIRECTLY IN FRONT OF A/C. TRIED TO AVOID EAGLE BUT IT HIT ON THE CO/P SIDE JUST INBD OF L PITOT TUBE. CREW ASSESSED DMG AND  COMPLETED AN UNEVENTFUL LDG. REPTD AS EAGLE,  ASSUME BALD FROM LOCATION. A/C = HH 60J"
636509,1990-12-23,"KENAI MUNICIPAL ARPT","AK","MARKAIR","DHC6",NA,"Moose","ON LDG ROLLOUT, STRUCK A MOOSE. BENT PROPELLER BLADES. VISIBILITY LESS THAN A MILE. FOG."
638646,2007-05-31,"WINNIPEG INTL","MB","SKYWEST AIRLINES","CRJ100/200",NA,"Unknown bird - small","AT NIGHT, A BIRD FLASHED BY. FOUND EVIDENCE ON LE OF RT WING AND RT LWR ENG COWL."
638856,2000-03-15,"KAHULUI ARPT","HI","HAWAIIAN AIR","DC-9-50",NA,"Upland sandpiper","DOWN & BLOOD STREAKS ON SIDE OF NOSE."
643351,2000-08-31,"LA GUARDIA ARPT","NY","PRO AIR","B-737-400",NA,"Unknown bird - large","BOTH MIDDLE AND INNER PANE WERE SHATERED SPRAYING COCKPIT WITH GLASS. OUTER PANE SEVERELY STRESSED AND FRACTURED. CAPT WAS SPARED EYE INJURY DUE TO GLASSES. SLOWED A/C TO 210 KTS & BECAUSE OF THE CREAKING SOUND & GLASS SHARDS COMING OFF THE WINDOW WE DEPRESSURIZED A/C. CONCUSSION WAVE CAUSED BY THE IMPACT CAUSED PILOTS TO HAVE RINGING EARS FOR SEVERAL HOURS AFTER & 6 HRS LATER MY FACE FEELS LIKE IT HAS A SUN BURN. CAPT INJURED BY GLASS. TAKEN TO HOSPITAL AS PRECAUTION AND RELEASED. PHOTO ATTACHED. PLANE OUT OF SVC 2 DAYS LOOKING FOR A WINDOW. CAPT THOUGHT BIRD MAY HAVE BEEN A CANADA GOOSE BECAUSE HE SAW BROWN FEATHERS."
647707,2001-01-14,"TROY MUNICIPAL ARPT","AL","BUSINESS","LEARJET-60",16796000,"White-tailed deer","HIT 2 DEER AND RAN OFF RWY. THRUST REVERSERS WERE NOT WORKING. PLANE WENT INTO A DITCH, BURST INTO FLAMES AND WAS DESTROYED. PILOT AND PAX WERE CRITICALLY INJURED: 2 BREAKS OF THE PELVIC BONE, 4 FRACTURED VERTEBRAE, CRUSHED RIGHT HIP, RT LEG PULLED FROM SOCKET AND VARIOUS CUTS AND BURNS. 2ND PILOT HAD CRUSHED L FOOT, CRUSHED L-3 LUMBAR, 2 FRACTURES & PUNCTURED L TIBIA AND 8 FRACTURES ON L ARM. RESCUERS KEPT THE FIRE AWAY FROM THE MEN  FOR 40 MINS UNTIL THEY COULD BE REMOVED FROM THE COCKPIT.  THIS WAS THE 2ND DEER STRIKE FOR THIS PLANE IN A MONTH. NTSB REPT WAS UPDATED 4/5/10. CAUSE WAS COLLLISION WITH DEER AND INADVERTENT THRUS REVERSER STOWAGE CAUSED BY DAMAGE TO LDG GEAR SQUAT SWITCH AND SUBSEQUENT APPLICATION OF FORWARD THRUST DURING ROLLOUT."
654131,2003-03-30,"TAVERNAERO PARK","FL","PRIVATELY OWNED","BE-36",NA,"Domestic/feral dog","NOT A STRIKE. PILOT SAW DOG DURING T/O ROLL. HE PULLED UP TO AVOID IT AND THE A/C ROLLED AND LEFT WING HIT THE GROUND. A/C THEN HIT TREES AND WAS DESTROYED. TWO PEOPLE HAD MINOR INJURIES (SMALL CUTS) NTSB SAYS SUBSTANTIAL DMG, PILOT REPTS IT WAS DESTROYED. AC = BE A36 SPEED = 65 KTS"
655125,2001-08-20,"DENVER INTL AIRPORT","CO","UNKNOWN","UNKNOWN",NA,"American badger","REMOVED A VERY LARGE BADGER AT THE 6000' DRM. BURIED.  TIME  0640."
661679,2003-10-22,"TED STEVENS ANCHORAGE INTL","AK","UNKNOWN","LEARJET",NA,"Moose","NOT A STRIKE, BUT AFFECTED FLT.  LEAR ON APCH HAD TO GO AROUND DUE TO MOOSE ON RWY. RWY CLOSED 4 MINS."
680764,2006-07-13,"SAN FRANCISCO INTL ARPT","CA","UNKNOWN","UNKNOWN",NA,"Golden eagle","REMAINS OF BIRD CARCAS ON RWY 19L LEVEE FOUND AT ABOUT 1830. BIRD WAS WEDGED IN THE ROCKS NEAR THE NW STAIRS OF THE LEVEE. ID BY SMITHSONIAN, FAA 1497"
682848,2006-09-29,"NORMAN Y. MINETA SAN JOSE INTL ARPT","CA","UNKNOWN","UNKNOWN",NA,"Golden eagle","STRIKE NOT REPTD TIME 1730, DAY."
685260,2007-07-22,"NORMAN Y. MINETA SAN JOSE INTL ARPT","CA","UNKNOWN","UNKNOWN",NA,"Golden eagle","REMAINS FOUND ON RWY 30R NEAR TWY GOLF DURING RWY INSPN. TIME 1410. STRIKE NOT REPTD"
685781,2007-09-27,"UNKNOWN",NA,"BUSINESS","EC130",453000,"Golden eagle","ID BY SMITHSONIAN, FAA 2104. SIGHTSEEING FLIGHT WAS TRAVERSING A BLUFF AREA BTWN COLORADO RIVER AND ARPT.  RAPTOR ENTERED THRU PILOT'S WINDOW PASSING INTO BACK ROW OF SEATS. HIT 1 PAX ON HEAD AND CUT 2ND ON THE ARM. PILOT HAD SOME BRUISING AND SCRATCHES. FRONT PILOT'S SIDE,  MIDDLE WINDOW & WINDOW SUPPORTS DMGD. ONE REPORT INDICATED SOME ROTOR DMG. PILOT MADE PREC LDG AT NEAREST FACILITY, UNCONTROLLED PEARCE FERRY ARPT."
690317,2008-04-12,"UNKNOWN",NA,"PRIVATELY OWNED","PA-18 SUPER CUB",NA,"Golden eagle","NO DMG EVASIVE MANEUVERS. PILOT SAW EAGLE CIRCLING AT SAME ALTITUDE AS A/C. AS HE GOT CLOSER HE NTICES THE BIRD WASN'T  GIVING WAY OR DIVING LIKE THEY USUALLY DO.  PILOT STARTED TO CLIMB. HE SAW THE EAGLE CUP ITS WINGS, CLAWS STRETCHED OUT AND IN FULL ATTACH SETTING. PILOT PULLED HARD ON THE TICK AND BIRD HIT THE LANDING GEAR. THE BIRD WAS CAUGHT IN IT. PHOTOS."
690699,2007-10-31,"DANE COUNTY REGIONAL ARPT-TRUAX FLD","WI","BUSINESS","C-550",75953,"Whooping crane","JUVENILE WHOOPING CRANE. SAW 4, HIT 1. LEFT INBD FLAP DMG. HAD TO RENT A FLAP WHILE REPAIRS WERE BEING MADE. THIS CRANE WAS PART OF THE FLOCK THAT WAS BEING TRAINED TO MIGRATE BY OPERATION MIGRATION AND WAS KNOWN AS DAR 741."
692878,2008-03-10,"DENVER INTL AIRPORT","CO","FRONTIER AIRLINES","A-319",86983,"Canada goose","ID BY SMIITHSONIAN, FAA 2363. HIT A FLOCK OF CANADA GEESE ON 1 MILE FINAL. DECLARED AN EMERGENCY DUE TO SMOKE IN THE COCKPIT AND DMG TO A/C. NOTAMS HAD BEEN ISSUED FOR MIGRATORY BIRDS AND WAS ALSO ON ATIS. LOSS OF FLUIDS NEAR TWY E/D AND ALSO BRAKE AND HYDRAULIC PROBLEMS. HAD TO BE TOWED. NOSE COWL DENTED. RADOME WAS REPLACED. NO ENG DMG."
698618,2008-12-25,"UNKNOWN",NA,"BUSINESS","EC130",14550,"White-tailed tropicbird","BIRD REPTD AS WHITE TAIL OR KAUAI TROPIC BIRD. HELICOPTER TOUR WITH 6 PAX ON BOARD OFF SHORE ALONG TUNNLES REEF NORTH SHORE OF KAUAI. CENTER WINDHSLD TOOK A DIRECT HIT MIDLEVEL. NEVER SAW BIRD. SOUNDED LIKE A CANNON BALL COMING THRU. COMPLETE SHATTERING OF CENTER LARGE WINDSHLD WITH BIRD ENERING COCKPIT AND STRIKING CENTER PAX IN FACE AND L SHOULDER. BIRD LANDED IN BACK SEAT. GLASS SHARDS COMPLETELY BLEW INTO A/C AND HIT PILOT & OTHER PAX. PILOT GOT CUTS ON RT HADN, THIGN AND UPPER ARM. I DID HAVE SAFETY SUNGLASSES ON AND IT SAVED MY EYES. RAING AND LOTS OF WIND COMING IN. SLOWED FROM 100 KTS TO 10 KTS AND LANDED AT PRINCEVILLE ARPT WHICH WS 5 MINS AWAY. CENTER PAX WENT TO ER. SHE WAS RELEASED WITH NO  MAJOR INJURIES. I WAS FIND WITH ONLY SML CUTS AND ABRASIONS. RETURNED TO WORK NEXT DAY. WITH 16 YRS OF TOURS ON KAUAI AND OVER 16,000 HRS OF TOURS ON KAUAI AND 3 BIRDSTRIKES DURING MY CAREER THIS WAS BY FAR THE WORST HIT AND COMPLETE LOSS OF A WINDSHLD IHAVE SEEN. A/C ROCKED AND SHUDDERED WITH THE IMPACT. HOLE WAS 4 FT LONG AND 2.5 FEET WIDE. COSTS ARE APPROX."
700640,2009-02-03,"DENVER INTL AIRPORT","CO","UNITED AIRLINES","B-757-200",20440000,"Bald eagle","ID BY SMITHSONIAN, FAA 3023 AND 3075.  WHOLE FEATHER, MICRO AND DNA ANALSIS USED. WHILE CLIMBING THRU 7500 FT MSL, PILOT REPORTED SEEING A LARGE BIRD AND WATCHED IT FOR SEVERAL SECONDS. HE THOUGHT PERHAPS AN EAGLE. . BIRD HIT UPPER SIDE OF #2 ENG COWLING MAKING  A 1-2 FT DENT BEFORE ENTERING THE ENGINE, WHERE IT DAMAGED ALL FAN BLADES. CREW REPTD 2 ENG SURGES AFTER THE EVENT BUT THE ENG CONTINUED TO PRODUCE THRUST. SMELL OF BURNT BIRD CAME THRU THE CABIN. PILOT DID NOT SHUT DOWN THE ENG.  AN AMBER ALERT PRECAUTIONARY LANDING WAS MADE. EMERGENCY VEHICLES RESPONDED. USDA/WS RESPONDED TO COLLECT SNARGE. MECHANICS WERE ADVISED TO COLLECT OTHER REMAINS/SNARGE WHEN THE WORKED ON THE ENGINE. MX STATED MINIMUM DMG WOULD BE $14-20 MILLION IN DIRECT COST. USDA WILL FOLLOW UP ON TOTAL COST OF DMG AND HRS OUT OF SERVICE. OTHER DM INCLUDED ACOUSTICAL PANELS AND INLET COWL. LOCAL NEWS REPORTED A PASSENGER SAID THERE WAS DEFINITELY PANIC ON BOARD BUT THERE WASN'T HYSTERIA AFTER THE STRIKE.  (DATA ENTRY NOTE: AAIPN REPTD DMG AS MINOR)"
708986,2010-02-03,"MIDLAND INTL","TX","UNKNOWN","UNKNOWN",NA,"Sprague's pipit","ID BY SMITHSONIAN. FAA 4057. WHOLE FEATHER. DNA.  FOUND DURING AIRFLD INSPN. 1155 AM DAY."
709276,2010-02-25,"SALT LAKE CITY INTL","UT","UNKNOWN","UNKNOWN",NA,"Golden eagle","DURING ROUTINE RWY INSPN, INJURED GOLDEN EAGLE OBSERVED IN SAFETY AREA OF RWY 34L. EAGLE HAD A BROKEN WING AND SCUFF MARKS ON ITS CLAWS. NO OTHER INJURIES OBSERVED. EAGLE CAPTURED AND GIVEN TO LOCAL RAPTURE REHAB EXPERT.  1645 PM DAY."
714722,2010-08-22,"YAMPA VALLEY","CO","BUSINESS","LEARJET-35",NA,"Golden eagle","SMALL PART OF BIRD WING MISSING. REST OF BIRD REMAINS WERE INTACT."
715043,2010-09-11,"ONTARIO INTL ARPT","CA","SOUTHWEST AIRLINES","B-737-300",NA,"Golden eagle","ON SHORT FINAL, HIT SUSPECTED HAWK ON LEFT WINGLET. NO DMG. A/C RETD TO SERVICE SOON AFTER A MX INSPN. BIRDERS FOUND THE EAGLE THE FOLLOWING DAY WITH WING SEVERED, BARELY ALIVE. THEY TOOK THE EAGLE BUT IT DIED. IT WAS GIVEN TO SOUTH BAY REHAB AND WILL BE SENT TO DEPOSITORY IN COLORADO. IT WAS FOUND 1.3 MILES AWAY FROM THE ARPT IN AN OPEN FIELD IN THE FLIGHT PATH."
716359,2010-10-21,"WASHINGTON DULLES INTL ARPT","DC","JETBLUE AIRWAYS","A-320",NA,"Bald eagle","NO APPARENT DAMAGE TO A/C. BIRD TAKEN TO WILDLIFE CENTER AND RECOVERED. 8.6LB MATURE MALE. ATIS WARNING. RWY OPEN AGAIN AT 2100."
718113,2010-11-22,"DENVER INTL AIRPORT","CO","UNKNOWN","UNKNOWN",NA,"Golden eagle","NO PIREP OF STRIKE, REMAINS FOUND ON REGULAR INSPN OF RWY. NO DMG REPTD. TIME FOUND, 1500. (DATA ENTRY NOTE: UAL FLT 369 HIT A BIRD JUST AFTER LIFTOFF. UNABLE TO CONFIRM IF THIS WAS THE BIRD THEY HIT.)"
721450,2011-06-16,"HENDERSON FIELD","UM","DELTA AIR LINES","B-747-400",NA,"Laysan albatross","WHILE ENRT, PILOTS NOTICED A LRG CRACK IN THE WINDSHLD FORCING THEM TO DISCONTINUE THE FLT. THEY DIVERTED TO MIDWAY ISLAND ARPT. ON APCH THEY HAD A DOUBLE BIRDSTRIKE. JUST PRIOR TO T/D A/C HIT A WHITE TERN OFF THE FUSELAGE. NO DMG FROM THAT BIRD. ONCE PARKED, A LAYSAN ALBATROSS CARCASS WAS STUCK IN THE RT REAR FLAP (PHOTO) WHICH DAMAGED THE FLAP SIGNIFICANTLY. HOLE WAS 3"" BY 15"". MECHANICS HAD TO BE FLOWN IN FOR REPAIRS.PAX WAITED ON BOARD UNTIL A REPLACEMENT JET WAS PROVIDED WITHIN 16 HRS."
722451,2011-07-13,"SOUTHWEST FLORIDA INTL ARPT","FL","AIRTRAN AIRWAYS","B-717-200",NA,"Least bittern","BIRD STRIKE DURING T/O ROLL. NO EFFECT ON FLT. PART STRUCK UNKN."
734377,2012-08-09,"MONTEREY PENINSULA","CA","BUSINESS","GULFSTREAM V",NA,"Golden eagle","ID BY SMITHSONIAN. 2 IMMATURE BIRDS FOUND. BIRDS WERE SITTING ON RWY AND FLEW UP INTO THE A/C HITTING NEAR THE DOOR. NO DMG."
736010,2012-08-07,"MC ALLEN MILLER INTL","TX","UNKNOWN","UNKNOWN",NA,"Common pauraque","FOUND AT 0745, DAY.  ID CONFIRMED BY BIRD SPECIALIST."
737556,2012-10-06,"MC ALLEN MILLER INTL","TX","UNKNOWN","UNKNOWN",NA,"Common pauraque","FOUND ON RWY DURING INSPN."
737723,2012-10-10,"WILL ROGERS WORLD ARPT","OK","SOUTHWEST AIRLINES","B-737-300",NA,"Sprague's pipit","ID BY SMITHSONIAN. HIT LEFT PILOT WINDOW AND FUSELAGE. NO DMG. BLOOD SMEAR ON WINDOW."
739153,2012-12-07,"CENTENNIAL ARPT","CO","BUSINESS","C-172",6820,"Bald eagle","WHILE ON 1/2 MILE FINAL, BIRD SHATTERED WINDSHIELD. BOTH PILOTS RECEIVED SMALL FACIAL LACERATIONS. THE BIRD WAS LARGE WITH A WHITE HEAD AND TAIL. REPORTED AS A BALD EAGLE. LATER REMAINS WERE FOUND AND ID CONFIRMED BY USDA/WS. THERE HAVE RECENTLY BEEN LOTS OF REPORTS FROM TOWER AND ON THE ATIS FOR FLOCKS OF BIRDS IN THE AREA."
739530,2012-12-24,"MC ALLEN MILLER INTL","TX","UNKNOWN","UNKNOWN",NA,"Sprague's pipit","FOUND BIRD JUST S OF C/L ON RWY 13 DURING RWY INSPN. 745 AM DAWN."
740251,2013-03-08,"UNKNOWN",NA,"PRIVATELY OWNED","CIRRUS SR 20/22",6720,"Golden eagle","ID BY SMITHSONIAN. LARGE BIRD STRUCK 20 NM S OF UNV. PILOT MADE A PREC LDG TO INVESTIGATE THE DAMAGE. LDG GEAR FAIRING WAS DAMAGED. MECHANIC ESTIMATES REPAIR TO BE $5000 PLUS $500 FOR INSPN."
740605,2013-03-22,"DENVER INTL AIRPORT","CO","SPIRIT AIRLINES","A-320",NA,"Golden eagle","PIREP OF BIRDSTRIKE. REMAINS FOUND ON RWY AT 7500 FEET DIST REM. DMG TO A/C UNKNOWN. A/C TAKEN OUT OF SERVICE FOR INSPN."
741668,2013-05-19,"DENVER INTL AIRPORT","CO","UNITED AIRLINES","A-319",NA,"Golden eagle","ARPT BIOL HAD NOT ADDITIONAL INFORMATION. BIRD WAS FOUND INTACT AND STILL ALIVE FOR A SHORT PERIOD OF TIME. (DATA ENTRY NOTE: CONTACTED UAL TO FOLLOW UP)"
741997,2013-05-13,"MC ALLEN MILLER INTL","TX","UNKNOWN","UNKNOWN",NA,"Common pauraque","BIRD FOUND AT INTXN OF 13/31 AND A3 AT MCALLEN INTNL ARPT DURING ROUTINE NIGHT AIRFLD INSPN. 2050 PM NIGHT."
743292,2013-06-27,"MC ALLEN MILLER INTL","TX","UNKNOWN","UNKNOWN",NA,"Common pauraque","840 AM DAY."
750677,2013-11-24,"DENVER INTL AIRPORT","CO","FRONTIER AIRLINES","A-319",NA,"Golden eagle","PILOT REPTD STRIKE UPON T/D TO RWY 35L. MX INSPECTED A/C AND DETERMINED BIRD STRUCK THE NOSE GEAR WITH NO DMG. REMAINS COLLECTED FROM RWY APPROX 3000 FEET FROM T/D."
752195,2014-03-14,"UNKNOWN",NA,"AMERICAN AIRLINES","B-737-800",NA,"Sprague's pipit","ID BY SMITHSONIAN. UNCONFIRMED LOCATION OF STRIKE. KDFW COLLECTED AND RECVD SNARGE FROM MX ON INCIDENT DATE. FOUND KDFW. 100 AM DAY."
752323,2014-03-10,"HENDERSON FIELD","UM","US COAST GUARD","LOCKHEED C-130",NA,"Bonin petrel","UPON FURTHER INVESTIGATION, A SECOND PETREL WAS FOUND NEATLY CUT IN TWO AND THE INITIAL PETREL LAY ON THE GROUND FROM SOME TYPE OF TRAUMA."
757216,2014-07-02,"MC ALLEN MILLER INTL","TX","UNKNOWN","UNKNOWN",NA,"Common pauraque","08:20 AM DAY"
759304,2014-08-18,"BRANDON MUNICIPAL","MB","BUSINESS","C-441 CONQUEST",66150,"Cedar waxwing","ID BY SMITHSONIAN. MULTIPLE SPECIES.  PHOTOS. THE ONLY INDICATION IN FLIGHT WAS A MOMENTARY ENGINE SOUND FLUCUTATION AND A 30 SECOND SMELL FROM VENTILATION SYSTEM. BORESCOPE INSPN REVEALED BIRD MATTER INSIDE ENG WHICH REQD AN EXTENSIVE BIRD INGESTION INSPN. (DATA ENTRY NOTE: # STRUCK NOT REPTD, ASSUME 1. FOLLOW UP WITH REPORTED FOUND THAT NO BIRDS WERE SEEN BUT A PHOTO WAS SENT OF BIRD REMAINS AND THEY DO NOT MATCH THE ID PROVIDED BY SMITHSONIAN. THE BIRD WAS MUCH LARGER. ALL REMAINS LIKELY NOT SENT FOR ID)"
762245,2014-10-25,"FRONT RANGE ARPT","CO","BUSINESS","AEROS 350",NA,"Ducks","PILOT HAD JUST COMPLETED A PRACTICE APCH TO RWY 35 AND WAS OVERFLYING THE RWY WHEN THE A/C COLLIDED WITH  A FLOCK OF DUCKS. ONE WENT THRU THE WINDSHLD AND ONTO THE PILOT. THE CO/P TOOK OVER CONTROL AND PROCEEDED TO RWY 26 AND HOVERED TO R2 TWY. LANDED SAFELY AT THEIR HANGER. THERE WAS A 12"" HOLE IN THE WINDSCREEN. THE PILOT RECEIVED CUTS AND SCRATCHES FROM THE WINDSHLD SHARDS AND WAS COVERED WITH BLOOD AND DUCK REMAINS. (DATA ENTRY NOTE: CHECKING WITH REPORTER FOR ID, COST AND AOS)"
764856,2014-12-06,"MC ALLEN MILLER INTL","TX","UNKNOWN","UNKNOWN",NA,"Common pauraque","8:25 AM DAY"
772275,2015-08-27,"MC ALLEN MILLER INTL","TX","UNKNOWN","UNKNOWN",NA,"Common pauraque","8:14 AM DAY"
772802,2015-08-29,"MC ALLEN MILLER INTL","TX","UNKNOWN","UNKNOWN",NA,"Common pauraque","8:10 AM DAY"
772973,2015-08-22,"MC ALLEN MILLER INTL","TX","UNKNOWN","UNKNOWN",NA,"Common pauraque","8:00 AM DAY"
773660,2015-09-29,"MC ALLEN MILLER INTL","TX","UNKNOWN","UNKNOWN",NA,"Common pauraque","0725AM DAY."
775426,2015-10-22,"NORMAN Y. MINETA SAN JOSE INTL ARPT","CA","UNKNOWN","UNKNOWN",NA,"Golden eagle","1415 DAY."
775495,2015-10-25,"DALLAS/FORT WORTH INTL ARPT","TX","UNKNOWN","UNKNOWN",NA,"Sprague's pipit","ONE UNKOWN SMALL SONGBIRD FOUND 60 FEET E OF RWY 31R C/L AND 300 FEET S OF TWY R3 C/L DURING CFR DRI. 950 DAY."
776921,2015-11-20,"NORMAN Y. MINETA SAN JOSE INTL ARPT","CA","BUSINESS","GULFSTREAM V",NA,"Golden eagle","STRUCK A/C LT WING WHILE ON LANDING FLARE FOR RWY 30L. OPS COLLECTED THE REMAINS OF ONE GOLDEN EAGLE FROM RWY 30L UPON IMMEDIATE RWY INSPN. LOCAL USFWS AND EAGLE REPOSITORY NOTIFIED BY PHONE MESSAGE UPON COLLECTION OF BIRD REMAINS. VISIBLE DMG TO LEFT  WING FLAP OBSERVED UPON INSPN. EXTENT OF DMG TO A/C UNKNOWN AT TIME OF REPORT."
777391,2015-11-06,"DALLAS/FORT WORTH INTL ARPT","TX","UNKNOWN","UNKNOWN",NA,"Sprague's pipit","DURING DRI, ONE BIRD FOUND.  RWY 36R, 85' E RWY C/L, 450' S TWY WN C/L.  8:30 AM DAY"
778721,2016-03-30,"SAN ANGELO REGNL ARPT/MATHIS FIELD","TX","ENVOY AIR","EMB-145",NA,"Sprague's pipit","NO DMG."
789472,2016-11-14,"NORMAN Y. MINETA SAN JOSE INTL ARPT","CA","UNKNOWN","UNKNOWN",NA,"Golden eagle","No pilots reported hitting the bird. Found in the middle of the Runway. Eagle Repository and Migratory Bird Permit Office were notified of the strike via voicemail."
798376,2017-08-14,"DENVER INTL AIRPORT","CO","UNKNOWN","UNKNOWN",NA,"Golden eagle","Golden Eagle reported on runway by departure aircraft. Bird found dead upon runway inspection. Unknown if bird was physically struck or killed by jet-wash. No reported strikes or damages. Time found 1800"
800265,2017-10-10,"UNKNOWN",NA,"SOUTHWEST AIRLINES","B-737-800",NA,"Least bittern","PILOT DISCOVERED ON PRE-TRIP INSPECTION, NOT REPORTED BY CREW LAST NIGHT. NOTE: Number of birds struck not reported, assume 1. FOUND KISP."
802576,2018-02-23,"UNKNOWN",NA,"UNITED AIRLINES","B-737-800",NA,"Sprague's pipit","Pilot unaware of strike (original info was incorrect). UAL mx collect remains from the RH MLG with no damages reported. Species of bird determined origin of strike at LAS on departure at 0643h (Flight Aware).  SPECIES SUGGESTS STRIKE LOCATION NOT LAX. FOUND KLAX."
806156,2017-03-24,"SALT LAKE CITY INTL","UT","PRIVATELY OWNED","CITATIONJET",28116,"Golden eagle","MOR Remarks: N551BC reported a birdstrike on an 8 mile final to RWY16R.  N551BC reported some control issues with the aircraft.  Emergency personnel dispatched to the aircraft.  N551BC landed without incident and exited RWY16R.  Emergency personnel responding to the aircraft reported a large divot on the aircraft's left elevator above the engine and below the stabilizer.  N551BC asked to call the tower to discuss the nature of the damage. /Remarks from 5200-7 or other report: NOTE: PHASE OF FLT NOT REPTD"
809698,2017-08-15,"DENVER INTL AIRPORT","CO","UNITED AIRLINES","B-737-700",NA,"Golden eagle","UAL1975 B737 REPORTED BIRD STRIKE DEPARTING RUNWAY 34L ON ROTATION. OPERATIONS 9 ADVISED TOWER BIRD STRIKE WAS A GOLDEN EAGLE. UAL1975 REPORTED NO KNOWN DAMAGE. LC4, 135.3"
812547,2018-08-21,"MC ALLEN MILLER INTL","TX","UNKNOWN","UNKNOWN",NA,"Common pauraque","DAWN 705."
812841,2018-08-26,"MC ALLEN MILLER INTL","TX","UNKNOWN","UNKNOWN",NA,"Common pauraque","DAY 705. SPECIES IDENTIFIED AS PAURAQUE"
815329,2017-06-04,"PRIVATE AIR STRIP",NA,"PRIVATELY OWNED","AERONCA 7AC CHAMPION",NA,"Moose","NOT A STRIKE BUT A NEGATIVE EFFECT ON FLIGHT. AVOIDANCE MANEUVER. The pilot reported that, after landing on a gravel airstrip (Mackey Lake Grass Airstrip)  during the taxi, a moose cow and calf ran onto the airstrip, moving from the pilot's right to left. She added that she veered to the left to avoid the animals and the airplane struck a tree. The airplane sustained substantial damage to the fuselage. NTSB probable cause and findings: The pilot's abrupt maneuver to avoid the moose cow and calf during taxi, which resulted in an impact with a tree."
820777,2018-10-11,"JACKSONVILLE INTL","FL","FEDEX EXPRESS","B-757-200",NA,"Least bittern","MOR Remarks: FDX1057 ADVISED JAX LOCAL CONTROL UPON ARRIVAL THAT THEY HAD A BIRD STRIKE OCCUR. UNKNOWN IF NAY DAMAGE OCCURRED. THE PIC CALLED JAX FLM AND A BIRD STRIKE INCIDNET/INGESTION REPORT WAS FILLED OUT AND SUBMITTED.  Other Remarks: No damage. Hit on fuselage just above f/o windshield. NOTE: Final runway 32 at1000' AGL"
824977,2019-04-30,"MOBILE DOWNTOWN ARPT","AL","UNKNOWN","UNKNOWN",NA,"Least bittern","TIME 530."
896477,2019-06-09,"VANCOUVER INTL","BC","AMERICAN AIRLINES","B-737-800",NA,"Golden eagle","Tower delayed landing clearance stating vehicle on the runway clearing birds. Clearance given with warning that birds were 200 ft agl on final. I saw 3 birds at 250 ft on final. I assumed they were the birds reported. Reported them to tower.Just as we were in the flare we saw 3 large birds directly on centerline. Appeared to be focused on something on the runway or just decided to land on that point. The went airborne just as we were in the flare. Two went left and one went right. We didn't hear anything or have any adverse engine indications or smells in the aircraft. We reported a possible strike to tower. The ground vehicle rechecked the runway and reported debris left of centerline.We notified company and local maintenance personnel met us on arrival and confirmed a bird strike.  We ingested a bird (possibly two based on the amount of debris) in the left engine.Most of the debris seemed to be concentrated on the outer edges of the stator vanes.Dollar amount of damage is unknown to me. I simply put a number in to allow the system to accept my report.Golden Eagle."
910521,2019-06-30,"EXECUTIVE ARPT","FL","UNKNOWN","UNKNOWN",NA,"Least bittern","Least Bittern found on runway during routine runway inspection."
935515,2019-04-01,"SIERRA VISTA MUNI ARPT-LIBBY ARMY AIRFIELD","AZ","US CUSTOMS AND BORDER PROTECTION","DRONE",NA,"Northern house wren","Evidence of the bird strike on the payload camera was found after landing. Since the long range camera (where the bird struck) was used during the enroute portion of the flight but not the approach, strike was presumed to occur during the approach or landing. There was no damage to the aircraft.changed from MQ9 (UA) to drone"
971529,2019-11-17,"DENVER INTL AIRPORT","CO","TRANS STATES AIRLINES","EMB-145",NA,"Golden eagle","Eagle body/wing found on RWY and head/wing found on TWY D5, fall off landing gear as it taxied in"
994853,2017-10-23,"WILEY POST-WILL ROGERS MEM","AK","ALASKA AIRLINES","B-737-700",NA,"Bearded seal","No actual strike.  A bearded seal was loafing at about the midpoint of the runway.  Because it is a marine mammal the appropriate personnel had to be contacted to address the situation.  The airport was closed for a period which delayed an outbound flight and an inbound flight had to circle until the seal was removed from the runway.No actual strike.  Closed airport.  Delayed departure of an aircraft and an inbound flight had to circle until the airport was reopened."
1019865,2020-07-24,"CORPUS CHRISTI INTL ARPT","TX","UNKNOWN","UNKNOWN",NA,"Common pauraque","Dead Nightjar found on RWY 13 during inspection.  Possibly struck by Coast Guard 2308 as they were the last ones on the runway before bird was found and bird was mostly whole. NIGHT. Nightjar/Common Pauraque"
1032685,2019-08-26,"CLEVELAND-HOPKINS INTL ARPT","OH","UNKNOWN","UNKNOWN",NA,"Common nighthawk","DAWN. REPORTED SPECIES AS NIGHTHAWK. 2.12.2020 emailed reporter to confirm band#1202-580. Bird was an orphan, hand-reared to releasable age on August 25, 2019 at Coe Lake, near Berea OH."
1033970,2016-09-13,"POLACCA ARPT","AZ","US CUSTOMS AND BORDER PROTECTION","EC120",NA,"Lesser nighthawk","No Damage to aircraft"
1038056,2020-09-14,"LUIS MUNOZ MARIN INTL","PR","US CUSTOMS AND BORDER PROTECTION","C-130",NA,"Semipalmated sandpiper","Pilot reported bird strike upon landing on RW 8-26. Three (3) small sandpipers were found during inspection. No damage to aircraft reported."
1039159,2020-09-25,"CAPITAL REGION INTL ARPT","MI","UNKNOWN","UNKNOWN",NA,"Kirtland's warbler","1 Kirtland's Warbler found on TWY H @ TWY D during standard ramp check.  Remains removed and disposed of. NOTE: NO PHOTO TAKEN.  Airport Ops reported ""Based on markings, it appeared to be a Kirtland's warbler""."
1062559,2020-08-02,"REID-HILLVIEW ARPT OF SANTA CLARA CNTY","CA","BUSINESS","C-172",12110,"Golden eagle","5 inches of leading edge damaged back to the spar. GOLF NOVEMBER AERO LLC. ""Original report stated Geese. Aviation Accident Summary WPR20LA256.Smithsonian Wildlife/Species Identification:Golden eagle (Aquila chrysaetos)Smithsonian Wildlife Identification Comments:Smithsonian remains received via NTSB investigator. Bird remains from aircraft and photographs from bird on ground are Golden Eagle NTSB # WPR20LA256  PENDING NTSB INVESTIGATION AS OF 11.5.2020.Continued approach to landing"
1082506,2005-07-26,"NASA SHUTTLE LANDING FACILITY","FL","GOVERNMENT","SPACE SHUTTLE",NA,"Turkey vulture","JUST AFTER LIFT-OFF, THE SPACE SHUTTLE  ""'DISCOVERY"" STRUCK AT LEAST 1 TURKEY VULTURE. NO OBVIOUS DAMAGE. NO REMAINS FOUND, BIRD THOUGHT TO HAVE BEEN VAPORIZED BY ROCKET PLUMES"
1087098,2010-10-27,"HENDERSON FIELD","UM","US COAST GUARD","LOCKHEED C-130",NA,"Brown noddy","PILOT REPTD SEEING A SML FLOCK OF ABOUT 5 BIRDS JUST AS HE WAS TOUCHING DOWN AND THOUGHT HE HIT THEM ALL. ONLY 1 CARCASS WAS FOUND, A BROWN NODDY CUT CLEAN IN HALF BY THE PROPELLER. NO DMG WAS REPTD. A/C LANDED SAFELY & DEPARTED W/O INCIDENT."
1091726,2020-08-15,"DENVER INTL AIRPORT","CO","SOUTHWEST AIRLINES","B-737-800",NA,"Golden eagle","Departing aircraft (N8555Z) SW007 DEN - LAX, reported hitting a bird departing RWY 34L. No damage reported and the flight continued to destination. Runway inspected. 1 large eagle found near D6. Eagle was dead but intact. Eagle removed from runway. aircraft also struck WTJR (2020-08-15-224921)"
